{
  "$schema": "https://json-schema.org/draft/2020-12/schema",
  "$id": "https://pokerapp.local/contracts/ledger_entry.schema.json",
  "title": "LedgerEntry",
  "version": "0.1",
  "description": "S3 draft (未 freeze)。金銭/価値イベント 1 件。append-only。cash+point 併用可。符号制約 (通常 kind は非負・非ゼロ移動, entry_fee は point 0, adjustment/reversal は符号付き)・残高非負・ledger↔point 整合は core が enforce。詳細は docs/contracts/ledger-overview.md / ledger-schema.md / ADR-0016。",
  "type": "object",
  "additionalProperties": false,
  "required": ["entry_id", "session_id", "player_id", "kind", "occurred_at", "cash_amount", "point_amount"],
  "properties": {
    "entry_id": {
      "type": "string",
      "pattern": "^[0-9a-f]{32}$",
      "description": "UUID4 hex (32 文字, lowercase)。ledger レイヤが採番。一意。"
    },
    "session_id": {
      "type": "string",
      "minLength": 1,
      "description": "所属 session の session_id (opaque 非空, S2)。金銭イベントは session スコープ。"
    },
    "player_id": {
      "type": "string",
      "pattern": "^[0-9a-f]{32}$",
      "description": "registry の player_id。実在は core が enforce (unknown_player)。"
    },
    "kind": {
      "type": "string",
      "enum": ["buy_in", "rebuy", "add_on", "order", "entry_fee", "adjustment"],
      "description": "イベント種別。entry_fee は cash only (point_amount=0, core)。adjustment / reversal (reverses_entry_id) は符号付き訂正。"
    },
    "occurred_at": {
      "type": "string",
      "format": "date-time",
      "description": "発生時刻 (ISO 8601)。"
    },
    "cash_amount": {
      "type": "integer",
      "description": "cash 分 (整数円, 1=¥1)。通常 kind は >=0、adjustment/reversal は符号付き可 (core が per-kind enforce)。"
    },
    "point_amount": {
      "type": "integer",
      "description": "point 充当分 (整数点)。通常 spend は >=0、reversal は負。!=0 のとき linked point_ledger_entry が delta_points=-point_amount で 1 件 (core)。entry_fee では 0。"
    },
    "note": {
      "type": "string",
      "description": "任意の備考 (手入力メモ / reversal の説明)。"
    },
    "hand_id": {
      "type": "integer",
      "minimum": 0,
      "description": "任意。将来 per-hand rake/fee 用フック ((session_id, hand_id) 複合参照)。S3 では未使用。"
    },
    "reverses_entry_id": {
      "type": "string",
      "pattern": "^[0-9a-f]{32}$",
      "description": "任意。reversal のとき相殺対象の entry_id。金額は対象の符号反転 (core)。"
    },
    "order": {
      "type": "object",
      "additionalProperties": false,
      "description": "kind=order のときのみ。注文明細。",
      "required": ["item_name", "unit_amount", "quantity"],
      "properties": {
        "item_name": {"type": "string", "minLength": 1, "description": "品目名。"},
        "unit_amount": {"type": "integer", "minimum": 0, "description": "単価 (整数円)。"},
        "quantity": {"type": "integer", "minimum": 1, "description": "数量。"}
      }
    }
  }
}
