{
  "entry_id": "c1b2c3d4e5f60718293a4b5c6d7e8f92",
  "session_id": "9f8e7d6c5b4a39281706f5e4d3c2b1a0",
  "player_id": "00000000000000000000000000000001",
  "kind": "order",
  "occurred_at": "2026-06-10T20:30:00",
  "cash_amount": 1000,
  "point_amount": 0,
  "order": {"item_name": "ドリンク", "unit_amount": 500, "quantity": 2}
}
